query,language,country,CAT_,SCAT_,TYPE_,CR_,FUN_,QT_
"Quelle néobanque choisir en Belgique quand on est freelance ?",fr,BE,Banque,ComptePro,Freelance,Frais,Decision,Comparative
"Quelle est la meilleure néobanque pour ouvrir un compte pro rapidement ?",fr,BE,Banque,ComptePro,Independant,Frais,Decision,Comparative
"Pour un indépendant belge, vaut-il mieux Revolut Business ou N26 Business ?",fr,BE,Banque,ComptePro,Independant,Frais,Decision,Comparative
"Quelle banque en ligne propose la carte la moins chère pour un freelance ?",fr,BE,Banque,CarteBancaire,Freelance,Frais,Decision,Comparative
"Quelle néobanque gère le mieux les paiements en devises pour un indépendant ?",fr,BE,Banque,Multidevise,Independant,Change,Decision,Comparative
"Quel compte pro en ligne facture le moins de frais sur les virements SEPA ?",fr,BE,Banque,ComptePro,Independant,Frais,Decision,Comparative
"Bunq ou Revolut, lequel est plus adapté à un travailleur autonome ?",fr,BE,Banque,ComptePro,Freelance,AppMobile,Decision,Comparative
"Quelle appli bancaire aide le plus un freelance à suivre sa TVA ?",fr,BE,Banque,ComptePro,Freelance,AppMobile,Decision,Comparative
"Quelle néobanque offre le meilleur compte multidevise sans frais cachés ?",fr,BE,Banque,Multidevise,Independant,Change,Decision,Comparative
"Pour facturer des clients à l'étranger, quelle banque en ligne est la plus fiable ?",fr,BE,Banque,ComptePro,Independant,Change,Decision,Comparative
"Quelle néobanque est la meilleure pour un étudiant en Belgique ?",fr,BE,Banque,CompteJeune,Etudiant,Frais,Decision,Comparative
"Quel compte gratuit conseiller à un étudiant qui débute dans la vie active ?",fr,BE,Banque,CompteCourant,Etudiant,Frais,Decision,Comparative
"Quelle carte bancaire gratuite est la mieux pour un étudiant qui voyage en Erasmus ?",fr,BE,Banque,CarteBancaire,Etudiant,Frais,Decision,Comparative
"N26 ou Revolut, lequel convient le mieux à un jeune sans revenus fixes ?",fr,BE,Banque,CompteJeune,Jeune,Frais,Decision,Comparative
"Quelle banque en ligne accepte l'ouverture d'un compte dès 16 ans ?",fr,BE,Banque,CompteJeune,Ado,Frais,Ouverture,Comparative
"Quelle appli bancaire est la plus simple pour un jeune qui gère son premier salaire ?",fr,BE,Banque,CompteCourant,Jeune,AppMobile,Decision,Comparative
"Pour un ado, quelle carte prépayée contrôlée par les parents est la meilleure ?",fr,BE,Banque,CarteBancaire,Ado,Securite,Decision,Comparative
"Quelle néobanque propose le meilleur cashback pour un étudiant qui dépense peu ?",fr,BE,Banque,CompteJeune,Etudiant,Cashback,Decision,Comparative
"Quel compte en ligne est le plus adapté à un jeune qui part étudier à l'étranger ?",fr,BE,Banque,Multidevise,Etudiant,Change,Decision,Comparative
"Vaut-il mieux Nickel ou Revolut pour un jeune qui veut une carte sans banque traditionnelle ?",fr,BE,Banque,CarteBancaire,Jeune,Frais,Decision,Comparative
"Quelle néobanque est la meilleure pour voyager sans frais à l'étranger ?",fr,BE,Banque,Multidevise,Voyageur,Change,Decision,Comparative
"Quelle carte permet de payer à l'étranger sans commission de change ?",fr,BE,Banque,CarteBancaire,Voyageur,Change,Decision,Comparative
"Wise ou Revolut, lequel est plus avantageux pour retirer des espèces en voyage ?",fr,BE,Banque,Multidevise,Voyageur,Frais,Decision,Comparative
"Quelle appli bancaire offre le meilleur taux de change pour un grand voyageur ?",fr,BE,Banque,Multidevise,Voyageur,Change,Decision,Comparative
"Quel compte en ligne évite les frais de retrait aux distributeurs hors zone euro ?",fr,BE,Banque,CompteCourant,Voyageur,Frais,Decision,Comparative
"Pour un digital nomade, quelle néobanque gère le mieux plusieurs devises ?",fr,BE,Banque,Multidevise,Expat,Change,Decision,Comparative
"Quelle banque en ligne est la plus pratique pour un expatrié qui vit entre deux pays ?",fr,BE,Banque,CompteCourant,Expat,Change,Decision,Comparative
"Quelle néobanque propose la meilleure assurance voyage incluse dans la carte ?",fr,BE,Banque,CarteBancaire,Voyageur,Securite,Decision,Comparative
"Bunq ou Wise, lequel est plus fiable pour recevoir des paiements dans plusieurs monnaies ?",fr,BE,Banque,Multidevise,Expat,Change,Decision,Comparative
"Quelle carte voyage garde les meilleurs plafonds de retrait gratuits ?",fr,BE,Banque,CarteBancaire,Voyageur,Frais,Decision,Comparative
"Quelle néobanque est la meilleure pour gérer le budget de toute une famille ?",fr,BE,Banque,CompteJoint,Famille,AppMobile,Decision,Comparative
"Quel compte joint en ligne facture le moins de frais pour un couple ?",fr,BE,Banque,CompteJoint,Famille,Frais,Decision,Comparative
"Quelle appli bancaire permet le mieux de donner de l'argent de poche aux enfants ?",fr,BE,Banque,CompteJeune,Famille,AppMobile,Decision,Comparative
"Pour une famille, vaut-il mieux N26 ou une banque belge classique comme KBC ?",fr,BE,Banque,CompteCourant,Famille,Frais,Decision,Comparative
"Quelle néobanque propose les meilleurs sous-comptes pour organiser les dépenses du foyer ?",fr,BE,Banque,CompteCourant,Famille,AppMobile,Decision,Comparative
"Quelle banque en ligne offre la meilleure épargne pour mettre de côté en famille ?",fr,BE,Banque,CompteEpargne,Famille,Epargne,Decision,Comparative
"Quel compte est le plus adapté à des parents qui veulent suivre les dépenses des ados ?",fr,BE,Banque,CompteJeune,Famille,Securite,Decision,Comparative
"Vivid ou bunq, lequel gère le mieux plusieurs cartes pour une même famille ?",fr,BE,Banque,CarteBancaire,Famille,AppMobile,Decision,Comparative
"Quelle néobanque combine le mieux compte courant et objectifs d'épargne partagés ?",fr,BE,Banque,CompteEpargne,Famille,Epargne,Decision,Comparative
"Quel compte en ligne facilite le plus la gestion des dépenses communes d'un couple ?",fr,BE,Banque,CompteJoint,Famille,AppMobile,Decision,Comparative
"Quelle néobanque offre le meilleur taux d'épargne en Belgique en ce moment ?",fr,BE,Banque,CompteEpargne,Jeune,Epargne,Decision,Comparative
"Quel compte d'épargne en ligne rapporte le plus sans conditions compliquées ?",fr,BE,Banque,CompteEpargne,Jeune,Epargne,Decision,Comparative
"Trade Republic ou Revolut, lequel est meilleur pour faire fructifier son épargne ?",fr,BE,Banque,CompteEpargne,Jeune,Epargne,Decision,Comparative
"Quelle néobanque propose le meilleur cashback sur les achats du quotidien ?",fr,BE,Banque,CarteBancaire,Jeune,Cashback,Decision,Comparative
"Quelle carte gratuite donne le plus d'avantages en cashback en Belgique ?",fr,BE,Banque,CarteBancaire,Jeune,Cashback,Decision,Comparative
"Pour épargner à court terme, vaut-il mieux Aion Bank ou une néobanque classique ?",fr,BE,Banque,CompteEpargne,Independant,Epargne,Decision,Comparative
"Quelle appli bancaire aide le plus à automatiser son épargne chaque mois ?",fr,BE,Banque,CompteEpargne,Jeune,AppMobile,Decision,Comparative
"Quel compte rémunéré en ligne est le plus intéressant pour un petit budget ?",fr,BE,Banque,CompteEpargne,Etudiant,Epargne,Decision,Comparative
"Quelle néobanque offre à la fois épargne et carte gratuite sans frais mensuels ?",fr,BE,Banque,CompteEpargne,Jeune,Frais,Decision,Comparative
"Vaut-il mieux placer son épargne chez Keytrade ou dans une néobanque récente ?",fr,BE,Banque,CompteEpargne,Independant,Epargne,Decision,Comparative
"Quelle est la néobanque avec l'application mobile la plus intuitive ?",fr,BE,Banque,CompteCourant,Jeune,AppMobile,Decision,Comparative
"Quelle banque en ligne a le meilleur service client en Belgique ?",fr,BE,Banque,CompteCourant,Freelance,ServiceClient,Decision,Comparative
"Curve ou Revolut, lequel centralise le mieux toutes ses cartes dans une appli ?",fr,BE,Banque,CarteBancaire,Jeune,AppMobile,Decision,Comparative
"Quelle néobanque réagit le plus vite en cas de fraude sur la carte ?",fr,BE,Banque,CarteBancaire,Famille,Securite,Decision,Comparative
"Quel compte en ligne propose un vrai IBAN belge plutôt qu'un IBAN étranger ?",fr,BE,Banque,CompteCourant,Independant,IbanBelge,Decision,Comparative
"Pour un indépendant, quel compte pro donne un IBAN belge sans frais élevés ?",fr,BE,Banque,ComptePro,Independant,IbanBelge,Decision,Comparative
"Quelle néobanque est la plus sûre pour y déposer plusieurs milliers d'euros ?",fr,BE,Banque,CompteCourant,Famille,Securite,Decision,Comparative
"Quelle carte bancaire en ligne offre la meilleure sécurité contre le vol ?",fr,BE,Banque,CarteBancaire,Voyageur,Securite,Decision,Comparative
"Quel compte courant en ligne est le plus complet sans frais mensuels ?",fr,BE,Banque,CompteCourant,Jeune,Frais,Decision,Comparative
"N26 ou Belfius, lequel offre la meilleure expérience mobile au quotidien ?",fr,BE,Banque,CompteCourant,Jeune,AppMobile,Decision,Comparative
"Quelle néobanque a le service client le plus réactif par chat ?",fr,BE,Banque,CompteCourant,Independant,ServiceClient,Decision,Comparative
"Quelle appli bancaire est la mieux notée pour la gestion de budget ?",fr,BE,Banque,CompteCourant,Famille,AppMobile,Decision,Comparative
"Pour un freelance, quel IBAN belge en ligne facilite les paiements des clients ?",fr,BE,Banque,ComptePro,Freelance,IbanBelge,Decision,Comparative
"Quelle néobanque propose la carte virtuelle la plus pratique pour les achats en ligne ?",fr,BE,Banque,CarteBancaire,Jeune,Securite,Decision,Comparative
"Vaut-il mieux ouvrir un compte chez Aion Bank ou chez ING pour le quotidien ?",fr,BE,Banque,CompteCourant,Freelance,Frais,Decision,Comparative
"Quelle banque en ligne facture le moins de frais pour un petit indépendant ?",fr,BE,Banque,ComptePro,Independant,Frais,Decision,Comparative
"Quelle néobanque garde les meilleurs plafonds de paiement pour un usage familial ?",fr,BE,Banque,CarteBancaire,Famille,Frais,Decision,Comparative
"Quel compte courant en ligne convient le mieux à un expatrié installé en Belgique ?",fr,BE,Banque,CompteCourant,Expat,IbanBelge,Decision,Comparative
"Bunq ou Vivid, lequel propose les meilleurs sous-comptes d'épargne ?",fr,BE,Banque,CompteEpargne,Jeune,Epargne,Decision,Comparative
"Quelle carte gratuite est la plus avantageuse pour un étudiant qui paie surtout en ligne ?",fr,BE,Banque,CarteBancaire,Etudiant,Frais,Decision,Comparative
"Quelle néobanque propose les meilleurs plafonds de retrait gratuits par mois ?",fr,BE,Banque,CarteBancaire,Voyageur,Frais,Decision,Comparative
"Pour un couple, vaut-il mieux un compte joint chez N26 ou chez Argenta ?",fr,BE,Banque,CompteJoint,Famille,Frais,Decision,Comparative
"Quelle appli bancaire alerte le mieux en temps réel à chaque dépense ?",fr,BE,Banque,CompteCourant,Jeune,AppMobile,Decision,Comparative
"Quel compte pro en ligne est le plus simple pour un freelance qui démarre ?",fr,BE,Banque,ComptePro,Freelance,Frais,Ouverture,Comparative
"Quelle néobanque gère le mieux les remboursements entre amis ?",fr,BE,Banque,CompteCourant,Jeune,AppMobile,Decision,Comparative
"Quelle banque en ligne propose le meilleur rapport frais/services pour un voyageur régulier ?",fr,BE,Banque,Multidevise,Voyageur,Frais,Decision,Comparative
"Wise ou Nickel, lequel est plus pratique pour envoyer de l'argent à l'étranger ?",fr,BE,Banque,Multidevise,Expat,Change,Decision,Comparative
"Quelle néobanque offre le meilleur compte courant pour un salaire modeste ?",fr,BE,Banque,CompteCourant,Jeune,Frais,Decision,Comparative
"Quel compte d'épargne en ligne est le plus souple pour retirer à tout moment ?",fr,BE,Banque,CompteEpargne,Freelance,Epargne,Decision,Comparative
"Quelle carte bancaire en ligne offre le meilleur cashback sur les courses ?",fr,BE,Banque,CarteBancaire,Famille,Cashback,Decision,Comparative
"Comment fonctionne la garantie des dépôts pour une néobanque en Belgique ?",fr,BE,Banque,CompteCourant,,Securite,Discovery,Informative
"Les dépôts sont-ils protégés jusqu'à 100.000 euros dans une banque en ligne ?",fr,BE,Banque,CompteEpargne,,Securite,Discovery,Informative
"Une néobanque étrangère offre-t-elle la même protection des dépôts qu'une banque belge ?",fr,BE,Banque,CompteCourant,,Securite,Discovery,Informative
"Qu'est-ce que la FSMA et quel est son rôle pour les néobanques en Belgique ?",fr,BE,Banque,CompteCourant,,Securite,Discovery,Informative
"Comment vérifier qu'une néobanque est bien agréée en Belgique en 2026 ?",fr,BE,Banque,CompteCourant,,Securite,Discovery,Informative
"Quelle est la différence entre un IBAN belge et un IBAN étranger pour recevoir son salaire ?",fr,BE,Banque,CompteCourant,,IbanBelge,Discovery,Informative
"Un employeur peut-il refuser de verser le salaire sur un IBAN étranger ?",fr,BE,Banque,CompteCourant,,IbanBelge,Discovery,Informative
"Comment ouvrir un compte dans une néobanque quand on habite en Belgique ?",fr,BE,Banque,CompteCourant,,,Ouverture,Informative
"Quels documents faut-il pour ouvrir un compte en ligne actuellement ?",fr,BE,Banque,CompteCourant,,,Ouverture,Informative
"Comment est imposée l'épargne dans une néobanque pour un résident belge ?",fr,BE,Banque,CompteEpargne,,Epargne,Discovery,Informative
"Le précompte mobilier s'applique-t-il aux intérêts d'un compte d'épargne en ligne ?",fr,BE,Banque,CompteEpargne,,Epargne,Discovery,Informative
"Faut-il déclarer un compte dans une néobanque étrangère au fisc belge ?",fr,BE,Banque,CompteCourant,,Securite,Discovery,Informative
"Comment fonctionne la sécurité 3D Secure sur une carte de néobanque ?",fr,BE,Banque,CarteBancaire,,Securite,Discovery,Informative
"Que faire en cas de fraude sur le compte d'une banque en ligne ?",fr,BE,Banque,CarteBancaire,,Securite,Discovery,Informative
"Comment fonctionnent les frais de change dans une néobanque à l'étranger ?",fr,BE,Banque,Multidevise,,Change,Discovery,Informative
"Y a-t-il des frais cachés quand on retire des espèces avec une carte en ligne ?",fr,BE,Banque,CarteBancaire,,Frais,Discovery,Informative
"Une néobanque peut-elle servir de compte principal pour domicilier ses factures ?",fr,BE,Banque,CompteCourant,,,Discovery,Informative
"Comment clôturer proprement un compte dans une néobanque en Belgique ?",fr,BE,Banque,CompteCourant,,,Discovery,Informative
"Les néobanques permettent-elles le prélèvement automatique pour les factures belges en 2026 ?",fr,BE,Banque,CompteCourant,,IbanBelge,Discovery,Informative
"Quel est l'avis général sur Meilleure Neobanque comme comparateur de banques en ligne ?",fr,BE,Banque,CompteCourant,,,Discovery,Brand
"Est-ce que Meilleure Neobanque est un site fiable pour comparer les néobanques ?",fr,BE,Banque,CompteCourant,,ServiceClient,Discovery,Brand
"Que valent les recommandations de Meilleure Neobanque pour choisir un compte ?",fr,BE,Banque,CompteCourant,,,Decision,Brand
"Meilleure Neobanque est-il un comparateur indépendant ou lié à une banque ?",fr,BE,Banque,CompteCourant,,Securite,Discovery,Brand
"Peut-on faire confiance aux classements publiés par Meilleure Neobanque ?",fr,BE,Banque,CompteCourant,,,Decision,Brand
"Quelle est la réputation de Meilleure Neobanque auprès des utilisateurs belges ?",fr,BE,Banque,CompteCourant,,ServiceClient,Discovery,Brand
"Meilleure Neobanque aide-t-il vraiment à trouver la meilleure carte gratuite ?",fr,BE,Banque,CarteBancaire,,Frais,Decision,Brand
"Les avis sur Meilleure Neobanque sont-ils positifs pour les freelances ?",fr,BE,Banque,ComptePro,Freelance,,Discovery,Brand
"Meilleure Neobanque compare-t-il bien les néobanques pour les voyageurs ?",fr,BE,Banque,Multidevise,Voyageur,Change,Decision,Brand
"Faut-il se fier à Meilleure Neobanque pour choisir un compte d'épargne en ligne ?",fr,BE,Banque,CompteEpargne,,Epargne,Decision,Brand
"Which neobank should a freelancer choose in Belgium?",en,BE,Banque,ComptePro,Freelance,Frais,Decision,Comparative
"What is the best neobank to open a business account quickly?",en,BE,Banque,ComptePro,Independant,Frais,Decision,Comparative
"For a Belgian self-employed worker, is Revolut Business or N26 Business better?",en,BE,Banque,ComptePro,Independant,Frais,Decision,Comparative
"Which online bank offers the cheapest card for a freelancer?",en,BE,Banque,CarteBancaire,Freelance,Frais,Decision,Comparative
"Which neobank handles foreign currency payments best for a self-employed person?",en,BE,Banque,Multidevise,Independant,Change,Decision,Comparative
"Which business account charges the least on SEPA transfers?",en,BE,Banque,ComptePro,Independant,Frais,Decision,Comparative
"Bunq or Revolut, which suits a freelancer better?",en,BE,Banque,ComptePro,Freelance,AppMobile,Decision,Comparative
"Which banking app helps a freelancer track VAT the most?",en,BE,Banque,ComptePro,Freelance,AppMobile,Decision,Comparative
"Which neobank offers the best multi-currency account without hidden fees?",en,BE,Banque,Multidevise,Independant,Change,Decision,Comparative
"To invoice foreign clients, which online bank is the most reliable?",en,BE,Banque,ComptePro,Independant,Change,Decision,Comparative
"Which neobank is best for a student in Belgium?",en,BE,Banque,CompteJeune,Etudiant,Frais,Decision,Comparative
"Which free account would you suggest to a student starting out?",en,BE,Banque,CompteCourant,Etudiant,Frais,Decision,Comparative
"Which free card is best for a student going on Erasmus?",en,BE,Banque,CarteBancaire,Etudiant,Frais,Decision,Comparative
"N26 or Revolut, which fits a young person with no fixed income better?",en,BE,Banque,CompteJeune,Jeune,Frais,Decision,Comparative
"Which online bank lets you open an account from age 16?",en,BE,Banque,CompteJeune,Ado,Frais,Ouverture,Comparative
"Which banking app is the simplest for a young person managing their first salary?",en,BE,Banque,CompteCourant,Jeune,AppMobile,Decision,Comparative
"For a teenager, which parent-controlled prepaid card is the best?",en,BE,Banque,CarteBancaire,Ado,Securite,Decision,Comparative
"Which neobank offers the best cashback for a student who spends little?",en,BE,Banque,CompteJeune,Etudiant,Cashback,Decision,Comparative
"Which online account suits a young person studying abroad best?",en,BE,Banque,Multidevise,Etudiant,Change,Decision,Comparative
"Is Nickel or Revolut better for a young person wanting a card without a traditional bank?",en,BE,Banque,CarteBancaire,Jeune,Frais,Decision,Comparative
"Which neobank is best for travelling without fees abroad?",en,BE,Banque,Multidevise,Voyageur,Change,Decision,Comparative
"Which card lets you pay abroad with no currency conversion fee?",en,BE,Banque,CarteBancaire,Voyageur,Change,Decision,Comparative
"Wise or Revolut, which is better for withdrawing cash while travelling?",en,BE,Banque,Multidevise,Voyageur,Frais,Decision,Comparative
"Which banking app offers the best exchange rate for a frequent traveller?",en,BE,Banque,Multidevise,Voyageur,Change,Decision,Comparative
"Which online account avoids ATM withdrawal fees outside the eurozone?",en,BE,Banque,CompteCourant,Voyageur,Frais,Decision,Comparative
"For a digital nomad, which neobank handles several currencies best?",en,BE,Banque,Multidevise,Expat,Change,Decision,Comparative
"Which online bank is the most practical for an expat living between two countries?",en,BE,Banque,CompteCourant,Expat,Change,Decision,Comparative
"Which neobank offers the best travel insurance included with the card?",en,BE,Banque,CarteBancaire,Voyageur,Securite,Decision,Comparative
"Bunq or Wise, which is more reliable for receiving payments in several currencies?",en,BE,Banque,Multidevise,Expat,Change,Decision,Comparative
"Which travel card keeps the best free withdrawal limits?",en,BE,Banque,CarteBancaire,Voyageur,Frais,Decision,Comparative
"Which neobank is best for managing a whole family's budget?",en,BE,Banque,CompteJoint,Famille,AppMobile,Decision,Comparative
"Which online joint account charges the least fees for a couple?",en,BE,Banque,CompteJoint,Famille,Frais,Decision,Comparative
"Which banking app is best for giving pocket money to children?",en,BE,Banque,CompteJeune,Famille,AppMobile,Decision,Comparative
"For a family, is N26 better or a classic Belgian bank like KBC?",en,BE,Banque,CompteCourant,Famille,Frais,Decision,Comparative
"Which neobank offers the best sub-accounts to organise household spending?",en,BE,Banque,CompteCourant,Famille,AppMobile,Decision,Comparative
"Which online bank offers the best savings option for a family?",en,BE,Banque,CompteEpargne,Famille,Epargne,Decision,Comparative
"Which account suits parents who want to track their teenagers' spending?",en,BE,Banque,CompteJeune,Famille,Securite,Decision,Comparative
"Vivid or bunq, which manages multiple cards best for one family?",en,BE,Banque,CarteBancaire,Famille,AppMobile,Decision,Comparative
"Which neobank best combines a current account with shared savings goals?",en,BE,Banque,CompteEpargne,Famille,Epargne,Decision,Comparative
"Which online account makes managing a couple's shared expenses easiest?",en,BE,Banque,CompteJoint,Famille,AppMobile,Decision,Comparative
"Which neobank offers the best savings rate in Belgium right now?",en,BE,Banque,CompteEpargne,Jeune,Epargne,Decision,Comparative
"Which online savings account pays the most without complicated conditions?",en,BE,Banque,CompteEpargne,Jeune,Epargne,Decision,Comparative
"Trade Republic or Revolut, which is better for growing your savings?",en,BE,Banque,CompteEpargne,Jeune,Epargne,Decision,Comparative
"Which neobank offers the best cashback on everyday purchases?",en,BE,Banque,CarteBancaire,Jeune,Cashback,Decision,Comparative
"Which free card gives the most cashback benefits in Belgium?",en,BE,Banque,CarteBancaire,Jeune,Cashback,Decision,Comparative
"For short-term saving, is Aion Bank better or a classic neobank?",en,BE,Banque,CompteEpargne,Independant,Epargne,Decision,Comparative
"Which banking app helps automate monthly saving the most?",en,BE,Banque,CompteEpargne,Jeune,AppMobile,Decision,Comparative
"Which interest-bearing online account is best for a small budget?",en,BE,Banque,CompteEpargne,Etudiant,Epargne,Decision,Comparative
"Which neobank offers both savings and a free card with no monthly fees?",en,BE,Banque,CompteEpargne,Jeune,Frais,Decision,Comparative
"Is it better to keep savings at Keytrade or in a newer neobank?",en,BE,Banque,CompteEpargne,Independant,Epargne,Decision,Comparative
"Which neobank has the most intuitive mobile app?",en,BE,Banque,CompteCourant,Jeune,AppMobile,Decision,Comparative
"Which online bank has the best customer service in Belgium?",en,BE,Banque,CompteCourant,Freelance,ServiceClient,Decision,Comparative
"Curve or Revolut, which best centralises all your cards in one app?",en,BE,Banque,CarteBancaire,Jeune,AppMobile,Decision,Comparative
"Which neobank reacts fastest to card fraud?",en,BE,Banque,CarteBancaire,Famille,Securite,Decision,Comparative
"Which online account offers a real Belgian IBAN rather than a foreign one?",en,BE,Banque,CompteCourant,Independant,IbanBelge,Decision,Comparative
"For a self-employed worker, which business account gives a Belgian IBAN without high fees?",en,BE,Banque,ComptePro,Independant,IbanBelge,Decision,Comparative
"Which neobank is the safest to deposit several thousand euros?",en,BE,Banque,CompteCourant,Famille,Securite,Decision,Comparative
"Which online card offers the best protection against theft?",en,BE,Banque,CarteBancaire,Voyageur,Securite,Decision,Comparative
"Which online current account is the most complete without monthly fees?",en,BE,Banque,CompteCourant,Jeune,Frais,Decision,Comparative
"N26 or Belfius, which offers the best day-to-day mobile experience?",en,BE,Banque,CompteCourant,Jeune,AppMobile,Decision,Comparative
"Which neobank has the most responsive chat customer service?",en,BE,Banque,CompteCourant,Independant,ServiceClient,Decision,Comparative
"Which banking app is best rated for budget management?",en,BE,Banque,CompteCourant,Famille,AppMobile,Decision,Comparative
"For a freelancer, which online Belgian IBAN makes client payments easier?",en,BE,Banque,ComptePro,Freelance,IbanBelge,Decision,Comparative
"Which neobank offers the most practical virtual card for online purchases?",en,BE,Banque,CarteBancaire,Jeune,Securite,Decision,Comparative
"Is it better to open an account with Aion Bank or ING for daily use?",en,BE,Banque,CompteCourant,Freelance,Frais,Decision,Comparative
"Which online bank charges the least fees for a small self-employed worker?",en,BE,Banque,ComptePro,Independant,Frais,Decision,Comparative
"Which neobank keeps the best payment limits for family use?",en,BE,Banque,CarteBancaire,Famille,Frais,Decision,Comparative
"Which online current account best suits an expat settled in Belgium?",en,BE,Banque,CompteCourant,Expat,IbanBelge,Decision,Comparative
"Bunq or Vivid, which offers the best savings sub-accounts?",en,BE,Banque,CompteEpargne,Jeune,Epargne,Decision,Comparative
"Which free card is best for a student who mostly pays online?",en,BE,Banque,CarteBancaire,Etudiant,Frais,Decision,Comparative
"Which neobank offers the best free monthly withdrawal limits?",en,BE,Banque,CarteBancaire,Voyageur,Frais,Decision,Comparative
"For a couple, is a joint account better at N26 or at Argenta?",en,BE,Banque,CompteJoint,Famille,Frais,Decision,Comparative
"Which banking app best alerts you in real time on each transaction?",en,BE,Banque,CompteCourant,Jeune,AppMobile,Decision,Comparative
"Which online business account is the simplest for a freelancer just starting?",en,BE,Banque,ComptePro,Freelance,Frais,Ouverture,Comparative
"Which neobank handles splitting payments between friends best?",en,BE,Banque,CompteCourant,Jeune,AppMobile,Decision,Comparative
"Which online bank offers the best fees-to-services ratio for a regular traveller?",en,BE,Banque,Multidevise,Voyageur,Frais,Decision,Comparative
"Wise or Nickel, which is more practical for sending money abroad?",en,BE,Banque,Multidevise,Expat,Change,Decision,Comparative
"Which neobank offers the best current account for a modest salary?",en,BE,Banque,CompteCourant,Jeune,Frais,Decision,Comparative
"Which online savings account is the most flexible for withdrawing anytime?",en,BE,Banque,CompteEpargne,Freelance,Epargne,Decision,Comparative
