query,language,country,CAT_,SCAT_,TYPE_,CR_,FUN_,QT_
"Which online card offers the best cashback on groceries?",en,BE,Banque,CarteBancaire,Famille,Cashback,Decision,Comparative
"How does deposit protection work for a neobank in Belgium?",en,BE,Banque,CompteCourant,,Securite,Discovery,Informative
"Are deposits protected up to 100,000 euros in an online bank?",en,BE,Banque,CompteEpargne,,Securite,Discovery,Informative
"Does a foreign neobank offer the same deposit protection as a Belgian bank?",en,BE,Banque,CompteCourant,,Securite,Discovery,Informative
"What is the FSMA and what role does it play for neobanks in Belgium?",en,BE,Banque,CompteCourant,,Securite,Discovery,Informative
"How can you check that a neobank is properly licensed in Belgium in 2026?",en,BE,Banque,CompteCourant,,Securite,Discovery,Informative
"What is the difference between a Belgian IBAN and a foreign IBAN for receiving your salary?",en,BE,Banque,CompteCourant,,IbanBelge,Discovery,Informative
"Can an employer refuse to pay a salary into a foreign IBAN?",en,BE,Banque,CompteCourant,,IbanBelge,Discovery,Informative
"How do you open an account with a neobank when living in Belgium?",en,BE,Banque,CompteCourant,,,Ouverture,Informative
"What documents are currently needed to open an online account?",en,BE,Banque,CompteCourant,,,Ouverture,Informative
"How is savings interest taxed in a neobank for a Belgian resident?",en,BE,Banque,CompteEpargne,,Epargne,Discovery,Informative
"Does the withholding tax apply to interest on an online savings account?",en,BE,Banque,CompteEpargne,,Epargne,Discovery,Informative
"Do you have to declare an account in a foreign neobank to the Belgian tax office?",en,BE,Banque,CompteCourant,,Securite,Discovery,Informative
"How does 3D Secure work on a neobank card?",en,BE,Banque,CarteBancaire,,Securite,Discovery,Informative
"What should you do in case of fraud on an online bank account?",en,BE,Banque,CarteBancaire,,Securite,Discovery,Informative
"How do currency exchange fees work in a neobank abroad?",en,BE,Banque,Multidevise,,Change,Discovery,Informative
"Are there hidden fees when withdrawing cash with an online card?",en,BE,Banque,CarteBancaire,,Frais,Discovery,Informative
"Can a neobank serve as a main account for domiciling your bills?",en,BE,Banque,CompteCourant,,,Discovery,Informative
"How do you properly close an account with a neobank in Belgium?",en,BE,Banque,CompteCourant,,,Discovery,Informative
"Do neobanks allow direct debit for Belgian bills in 2026?",en,BE,Banque,CompteCourant,,IbanBelge,Discovery,Informative
"What is the general opinion on Meilleure Neobanque as an online bank comparison site?",en,BE,Banque,CompteCourant,,,Discovery,Brand
"Is Meilleure Neobanque a reliable site for comparing neobanks?",en,BE,Banque,CompteCourant,,ServiceClient,Discovery,Brand
"How good are the recommendations from Meilleure Neobanque for choosing an account?",en,BE,Banque,CompteCourant,,,Decision,Brand
"Is Meilleure Neobanque an independent comparison site or tied to a bank?",en,BE,Banque,CompteCourant,,Securite,Discovery,Brand
"Can you trust the rankings published by Meilleure Neobanque?",en,BE,Banque,CompteCourant,,,Decision,Brand
"What is the reputation of Meilleure Neobanque among Belgian users?",en,BE,Banque,CompteCourant,,ServiceClient,Discovery,Brand
"Does Meilleure Neobanque really help find the best free card?",en,BE,Banque,CarteBancaire,,Frais,Decision,Brand
"Are the reviews of Meilleure Neobanque positive for freelancers?",en,BE,Banque,ComptePro,Freelance,,Discovery,Brand
"Does Meilleure Neobanque compare neobanks well for travellers?",en,BE,Banque,Multidevise,Voyageur,Change,Decision,Brand
"Should you rely on Meilleure Neobanque to choose an online savings account?",en,BE,Banque,CompteEpargne,,Epargne,Decision,Brand
