query,language,country,CAT_,SCAT_,TYPE_,CR_,FUN_,QT_
Should you accept the installation of a smart meter in Belgium?,en,BE,Energie,CompteurIntelligent,Menage,Flexibilite,Discovery,Informative
What premiums exist for green electricity or solar panels in 2026?,en,BE,Energie,EnergieVerte,Proprietaire,EnergieVerte,Discovery,Informative
How does the prosumer tariff for solar panels work in Flanders?,en,BE,Energie,EnergieVerte,Proprietaire,Region,Discovery,Informative
What is a guarantee of origin for green electricity in Belgium?,en,BE,Energie,EnergieVerte,Menage,EnergieVerte,Discovery,Informative
How can you tell whether a contract's electricity is genuinely renewable?,en,BE,Energie,EnergieVerte,Menage,Transparence,Discovery,Informative
How to read and understand your electricity bill in Belgium?,en,BE,Energie,Electricite,Menage,Transparence,Discovery,Informative
What do network costs and taxes represent on an electricity bill?,en,BE,Energie,Electricite,Menage,Transparence,Discovery,Informative
How to estimate your yearly electricity consumption in kWh?,en,BE,Energie,Electricite,Menage,Prix,Discovery,Informative
What is the average electricity consumption of a four-person family?,en,BE,Energie,Electricite,Famille,Prix,Discovery,Informative
How does a day-and-night dual-hourly electricity rate work?,en,BE,Energie,TarifNuit,Menage,Prix,Discovery,Informative
Is the night rate still worthwhile with a digital meter?,en,BE,Energie,TarifNuit,Menage,Flexibilite,Discovery,Informative
How does a dual electricity-and-gas contract work in Belgium?,en,BE,Energie,Dual,Menage,Prix,Discovery,Informative
What to do about an abnormally high electricity bill?,en,BE,Energie,Electricite,Menage,ServiceClient,Discovery,Informative
How to concretely reduce your electricity bill day to day?,en,BE,Energie,Electricite,Menage,Prix,Discovery,Informative
What support exists for a self-employed person facing electricity costs in 2026?,en,BE,Energie,Electricite,Independant,Prix,Discovery,Informative
How to sign up for an electricity contract when moving into a home?,en,BE,Energie,Electricite,JeuneMenage,Flexibilite,Souscription,Informative
What price changes for electricity are expected in Belgium in 2026?,en,BE,Energie,Electricite,Menage,Prix,Discovery,Informative
How good are the electricity deals from Meilleur Fournisseur Electricite?,en,BE,Energie,Electricite,Menage,Prix,Discovery,Brand
Is Meilleur Fournisseur Electricite reliable for comparing Belgian suppliers?,en,BE,Energie,Electricite,Menage,Transparence,Discovery,Brand
What do customers say about Meilleur Fournisseur Electricite?,en,BE,Energie,Electricite,Menage,ServiceClient,Discovery,Brand
Does Meilleur Fournisseur Electricite really offer the cheapest rates?,en,BE,Energie,Electricite,Menage,Prix,Comparaison,Brand
Can you trust the comparisons from Meilleur Fournisseur Electricite?,en,BE,Energie,Electricite,Menage,Transparence,Comparaison,Brand
Does Meilleur Fournisseur Electricite cover green electricity in its comparisons?,en,BE,Energie,EnergieVerte,Menage,EnergieVerte,Discovery,Brand
How does Meilleur Fournisseur Electricite's service work for switching supplier?,en,BE,Energie,Electricite,Menage,Flexibilite,Souscription,Brand
Is Meilleur Fournisseur Electricite useful for a tenant who moves often?,en,BE,Energie,Electricite,Locataire,Flexibilite,Discovery,Brand
Does Meilleur Fournisseur Electricite help find a good fixed electricity rate?,en,BE,Energie,TarifFixe,Menage,Flexibilite,Comparaison,Brand
What is the reputation of Meilleur Fournisseur Electricite among Belgian households?,en,BE,Energie,Electricite,Menage,ServiceClient,Discovery,Brand
