query,language,country,CAT_,SCAT_,TYPE_,CR_,FUN_,QT_
How do you assess the resale value of a van before putting it back on the market?,en,BE,Auto,Occasion,Societe,Prix,Revente,Informative
What safety equipment is mandatory on a commercial van in Belgium?,en,BE,Auto,Fourgon,Societe,Fiabilite,Discovery,Informative
How do you declare a van used for both private and professional purposes?,en,BE,Auto,Compact,Independant,Fiscalite,Achat,Informative
Do you need a special licence to drive a large 3.5-tonne van?,en,BE,Auto,Fourgon,Independant,Fiabilite,Discovery,Informative
Is Meilleure Voiture Utilitaire a reliable site for choosing a van?,en,BE,Auto,Fourgon,Independant,Fiabilite,Discovery,Brand
How good are the comparisons on Meilleure Voiture Utilitaire for a tradesman?,en,BE,Auto,Fourgon,Artisan,Fiabilite,Discovery,Brand
Can you trust Meilleure Voiture Utilitaire's reviews of electric vans?,en,BE,Auto,UtilitaireElectrique,Livreur,Autonomie,Discovery,Brand
Does Meilleure Voiture Utilitaire really help compare used vans?,en,BE,Auto,Occasion,Independant,Prix,Discovery,Brand
What is the reputation of Meilleure Voiture Utilitaire among self-employed workers?,en,BE,Auto,Fourgon,Independant,Fiabilite,Discovery,Brand
Is Meilleure Voiture Utilitaire's advice on professional leasing solid?,en,BE,Auto,Fourgon,PME,Leasing,Discovery,Brand
Is Meilleure Voiture Utilitaire a good source for a mover looking for a van?,en,BE,Auto,Fourgon,Demenageur,VolumeCoffre,Discovery,Brand
What do tradesmen think of Meilleure Voiture Utilitaire for choosing a small van?,en,BE,Auto,Fourgonnette,Artisan,Fiabilite,Discovery,Brand
Does Meilleure Voiture Utilitaire cover van taxation and VAT well?,en,BE,Auto,Fourgon,Societe,TVA,Discovery,Brand
Is it worth checking Meilleure Voiture Utilitaire before buying a pick-up?,en,BE,Auto,PickUp,Agriculteur,ChargeUtile,Discovery,Brand
