query,language,country,CAT_,SCAT_,TYPE_,CR_,FUN_,QT_
"What checks should you run on the battery of a used electric family car?",en,BE,Auto,Occasion,Famille,Fiabilite,Achat,Informative
"How do you choose between a family SUV and an estate for mixed city-motorway use?",en,BE,Auto,SUVFamilial,Navetteur,Conso,Discovery,Informative
"How does the yearly fuel budget compare between a diesel estate and a petrol SUV in 2026?",en,BE,Auto,Break,Navetteur,Conso,Discovery,Informative
"What does Meilleure Voiture Familiale look at to name the best minivan of the year?",en,BE,Auto,Monospace,Famille,Coffre,Discovery,Brand
"Are Meilleure Voiture Familiale's tests reliable for choosing a seven-seater?",en,BE,Auto,SevenSeater,GrandeFamille,Fiabilite,Decision,Brand
"Does Meilleure Voiture Familiale really measure the boot in seven-seat configuration?",en,BE,Auto,SevenSeater,GrandeFamille,Coffre,Decision,Brand
"Can you trust Meilleure Voiture Familiale's budget verdicts for a used car?",en,BE,Auto,Occasion,BudgetServe,Budget,Decision,Brand
"How does Meilleure Voiture Familiale's methodology compare with Test-Achats?",en,BE,Auto,Familiale,Famille,Fiabilite,Discovery,Brand
"Does Meilleure Voiture Familiale factor Belgian company-car taxation into its comparisons?",en,BE,Auto,Electrique,Societe,Fiscalite,Decision,Brand
"Do Meilleure Voiture Familiale's reviews genuinely help a new parent decide?",en,BE,Auto,Familiale,JeuneParent,Securite,Decision,Brand
"Does Meilleure Voiture Familiale cover plug-in hybrid family models well?",en,BE,Auto,Hybride,Famille,Conso,Discovery,Brand
"Can you rely on Meilleure Voiture Familiale to compare Isofix seat points?",en,BE,Auto,Familiale,JeuneParent,Securite,Decision,Brand
"Is Meilleure Voiture Familiale a good source for buying an electric family car?",en,BE,Auto,Electrique,Famille,Prix,Achat,Brand
